"","id","sentence","difficulty"
"1180","1180","mais déjà le commerce équitable commence à être récupéré par des entrepreneurs au nez creux et peu soucieux de respecter les critères fondamentaux trop contraignants ","C1"
"1181","1181","c est les discussions d aujourd hui ","A2"
"1182","1182","cette assurance me calma  je sentis ma douleur s apaiser ","C2"
"1183","1183","papa raconte une histoire aux enfants pour les endormir ","A1"
"1184","1184","mis en place par l éco organisme récylum ce dispositif intéresse en premier lieu les entreprises du bâtiment mais aussi les industries et les collectivités territoriales qui détiennent du matériel alarmes incendie caméras de surveillance qui ne fonctionne plus ","B2"
"1185","1185","j en conclus que les réalistes de talent devraient s appeler plutôt des illusionnistes ","C1"
"1186","1186","vous ouvrîtes la boîte à musique et découvrîtes un bijou serti de pierres précieuses multicolors ","C1"
"1187","1187","si nous avions eu suffisament d argent nous aurions pris l avion pour nous rendre à notre conférence sur les enjeux écologiques du siècle et ainsi participer activement au débat ","B2"
"1188","1188","je ne veux pas ","A1"
"1189","1189","la journée est longue pour david qui attend le samedi toute la semaine ","A2"
"1190","1190","nous souhaitons favoriser davantage la création et l ouverture à d autres publics  explique nathalie perrin gilbert ","C1"
"1191","1191","je me réjouis de te revoir pendant les vacances ","A2"
"1192","1192","de fait les relations de l individu au groupe du privé au collectif demeurent complexes dans l hexagone ","B2"
"1193","1193","il était une fois une petite fille de village ","A2"
"1194","1194","l addition s il vous plaît ","A1"
"1195","1195","ils doivent également présenter le cas échéant les documents justifiant de l objet et des conditions de leur séjour","C1"
"1196","1196","un petit garçon  on essaye de leur parler","A2"
"1197","1197","le couple a bien fait d évacuer","A2"
"1198","1198","lorsqu elle eut revu son premier amoureux son coeur battit follement","C2"
"1199","1199","de fait en scindant son enseignement supérieur en deux systèmes concurrents la france a créé une hiérarchie dans toutes les têtes la grande école est synonyme de réussite l université de rebut ","C2"
"1200","1200","on le trouvera ridicule et ce sera une catastrophe ","B1"
"1201","1201","qu est ce que vous avez comme tartes ","A1"
"1202","1202","on partait de bonne heure pour ne pas être coincés dans les embouteillages","A2"
"1203","1203","la fao organisation pour l alimentation et l agriculture estime que 95  des personnes victimes de sous alimentation chronique vivent dans les pays en voie de développement ","C1"
"1204","1204","on vient d acheter une résidence secondaire au pays basque qui sera notre point de ralliement familial ","C1"
"1205","1205","l échange c est à dire l interaction verbale se présente comme une co construction constitutive de la dynamique du groupe  c est en tenant compte des interlocuteurs et de la façon dont ils se positionnent les uns vis à vis des autres selon les objets et les enjeux des interactions que l on envisage d analyser tant la variation des usages en présence que l hétérogénéité constitutive du dire dans cet espace ","C2"
"1206","1206","mon mari a enfin trouvé une place d architecte et travaille sur un important projet d immeuble avec son équipe","B1"
"1207","1207","c est somptueux ","A2"
"1208","1208","bonne chance ","A1"
"1209","1209","j ouvrais la porte et le chien courait à l extérieur ","A2"
"1210","1210","mais qu ils prétendent être les seuls acteurs légitimes pour définir et normaliser le commerce équitable c est nier les autres pratiques et refuser le débat avec tous les acteurs de la société civile ce qui est inadmissible ","C1"
"1211","1211","non je ne parle pas français ","A1"
"1212","1212","il est tombé malade l année précédant son mariage ","B2"
"1213","1213","les maires ont ainsi voulu montrer qu ils les avaient à l oeil ","B1"
"1214","1214","il allait devoir passer l hiver ici dans la forêt en attendant d être guérit ","B1"
"1215","1215","il est très fâché parce qu elle ne lui a pas répondu au téléphone ","A1"
"1216","1216","celui ci ancien soldat devinant d abord le plan de campagne de son interlocuteur parla des protections qu avait son maître ajoutant que certes on ne lui chiperait pas ses beaux chevaux ","C1"
"1217","1217","je ne te crois pas ","A1"
"1218","1218","le journal a été emporté par un coup de vent ","B1"
"1219","1219","les optimistes soulignent qu il ne représente encore qu une part infinitésimale des échanges internationaux mais que le concept est porteur ","C1"
"1220","1220","sans y penser j ai fait des erreurs ","B1"
"1221","1221","quand tu sors de l ascenseur tourne à droite et encore à droite ","A2"
"1222","1222","et il regardait tous ces hommes attablés et buvant tous ces hommes qui pouvaient se désaltérer tant qu il leur plaisait ","B2"
"1223","1223","elle a préparé les photocopies pour les participants à la réunion de l après midi","B1"
"1224","1224","ainsi madame qui est irlandaise et vit à lieu témoigne  en france si je parle anglais à mon fils il me répond plutôt en français ","B1"
"1225","1225","capacités intellectuelles ou problèmes d orientation ","B2"
"1226","1226","a affronter ce monde et l améliorer ","A2"
"1227","1227","deux guerres mondiales en 1914 et 1939 convainquirent cependant de nombreux européens que le concert européen avait échoué et ne parvenait plus à gérer les affaires du continent ","C2"
"1228","1228","il y a des cours de portugais ","A1"
"1229","1229","les spécialistes de la violence chez les adolescents rappellent qu il est dangereux de les considérer comme une armée menaçante ","B1"
"1230","1230","malheureusement il ne s agit que de moyenne ","B1"
"1231","1231","le paysage devient tout blanc à cause de la neige et de la glace ","A1"
"1232","1232","l après midi j ai encore beaucoup de choses à faire","A2"
"1233","1233","de fait la nature peut être par l homme changée tout à fait transformée ébranlée jusqu en ses fondements et c est pourquoi il sied de réhabiliter le mot de magie en lui redonnant le sens honorable qu il avait autrefois et en désignant par là une science justement ambitieuse qui de la connaissance des formes cachées déduit des opérations étonnantes ","C2"
"1234","1234","le bleu est très présent dans la nature  c est la couleur du ciel et de la mer ","A1"
"1235","1235","elle fais ses devoirs puis prépare le dîner et finalement elle regarde un film avant d aller se coucher ","A2"
"1236","1236","pas de fête avec vous ce soir","A1"
"1237","1237","je n arrive plus à dormir depuis quelques jours à cause de mes voisins et leurs travaux ","A2"
"1238","1238","c était une chétive créature une masse de chair ridée avec des paupières entre closes des traits informes et à peine ébauchés ","C2"
"1239","1239","j aime les pommes de terre ","A1"
"1240","1240","elle a juste miaulé craintivement et s est recroquevillée sur sa branche oú elle se trouve ","B2"
"1241","1241","mesdames messieurs votre attention s il vous plaît ","A2"
"1242","1242","en cinquante ans les progrès accomplis par les techniques de l information ont entraîné une amplification extraordinaire des flux d informations ","C1"
"1243","1243","je regarde un film en allemand ","A1"
"1244","1244","les vacances sont les moments préférés de pierre car il a pour habitude d aller chez ses grands parents qui vivent dans une ferme de la campagne normande","A1"
"1245","1245","figurez vous un turc allant la nuit chez paul niquet ","B2"
"1246","1246","la comtesse s était passionnée pour le caractère primitif et pour l astrologie de l abbé blanès ","C1"
"1247","1247","pour dissuader ses lyce ens de faire les beaux arts l e cole du cirque ou un diplo me d arts du spectacle un proviseur avait coutume de leur raconter cette histoire  j avais deux copains","C1"
"1248","1248","perrette retenant sa respiration tellement était forte l odeur nauséabonde d huile de vidange dans la chambre garage ","C1"
"1249","1249","néanmoins l introduction de la notion de genre dans la santé entraîne une meilleure compréhension des processus biologiques et sociaux intriqués qui influencent les trajectoires de santé des hommes et des femmes ","C1"
"1250","1250","pour conjurer les deux mois de vacances ils ache tent donc leur potion en librairie pour un investissement moyen de 7 euros","C2"
"1251","1251","le courant d air ainsi créé permet à la sueur  qui absorbe la chaleur du corps  de s évaporer et ainsi de le refroidir ","B1"
"1252","1252","la pelle les pincettes et le bec du soufflet tous de proportion colossale brillaient comme de l acier poli tandis que le long des murs s étendait une abondante batterie de cuisine où miroitait inégalement la flamme claire du foyer jointe aux premières lueurs du soleil arrivant par les carreaux ","C2"
"1253","1253","mais les chiens et les chats ne s aiment pas beaucoup ","A1"
"1254","1254","il s offre les meilleurs guides gravit les montagnes s e panouit","C1"
"1255","1255","les préadolescents et adolescents semblent particulièrement sensibles ","B2"
"1256","1256","les cordes vocales ce sont des muscles hein et donc j ai un entraînement quotidien parce qu on doit être raccord avec des enregistrements qui ont quelquefois 10 voire 15 ans","B2"
"1257","1257","elle trouvait ça drôle finissait par rire et s animant commençait à trottiner derrière lui avec de légers cris joyeux et craintifs quand elle 143 avait cru le saisir ","C2"
"1258","1258","il est en train de ranger ses affaires ","A2"
"1259","1259","tout comme la révolution industrielle a vu naître le capitalisme je suis persuadé que la robolution va profondément modifier notre système économique ","B2"
"1260","1260","on a ainsi constaté chez les femmes urbaines de haut niveau socio économique au brésil 28  de réduction de la surcharge pondérale de 1989 à 1997 ","C1"
"1261","1261","cette réponse me bouleversa ","C2"
"1262","1262"," les dames rient je pense qu il y aurait de la bagarre hein","A2"
"1263","1263","tu ne mérites pas d en manger dit l autre ","A2"
"1264","1264","jeune retraité de l éducation nationale roger rougier a sa réponse ","C1"
"1265","1265","tout se passe bien en france ","B1"
"1266","1266","non elle est fleuriste ","A1"
"1267","1267","sans enfants à cinquante neuf ans guido avait de son propre coeur préparé pour son enfant à venir un coeur modelé sur sa propre préoccupation  l hommage sans remords à la noblesse la génuflexion que fait par contraction musculaire le corps pourchassé en s affalant devant ce qui est imminent et inaccessible comme devant une grande chaleur ","C2"
"1268","1268","le plat plein ploie sous le poids ou ne ploie point ","C2"
"1269","1269","et vous l entendez ce violon qui joue du klezmer la musique traditionnelle des juifs itinérants ","B2"
"1270","1270","un principe qui concerne déjà de nombreux produits tels que les emballages les textiles et les pneus ","B2"
"1271","1271","non bien sûr que non ","A2"
"1272","1272","j ai une soeur","A1"
"1273","1273","et j adresse un défi collectif au parterre ","B2"
"1274","1274","en étant connecté en permanence à ses amis et en pouvant se raccrocher à des environnements en ligne familiers comme sa page facebook son compte twitter ou sa story snapchat la personne éloignée de son environnement familier ne se sentirait elle pas alors davantage en sécurité affective comme dans son foyer où elle a ses repères et habitudes rassurants ","C2"
"1275","1275","la blanquette est bonne ","A2"
"1276","1276","l empereur était à paris ","B1"
"1277","1277","je m appelle laurent et j habite à paris avec mes parents ma soeur ainée et mon frère ","A2"
"1278","1278","puis il y eut une pause lugubre suivie d un vaste soupir d agonie où l on eût dit que l âme de la grosse cloche s exhalait ","C2"
"1279","1279","la règle du frein à l endettement devrait traiter de manière symétrique les dépassements de dépenses et les économies réalisées ","C1"
"1280","1280","la spirale vicieuse cette mécanique qui entraîne vers le bas n est pas dans le discours des milieux populaires liée à une conjoncture négative ","B2"
"1281","1281","ils ne se parlent plus depuis qu ils se sont disputés ","B1"
"1282","1282","pour yak rivais le langage fait certes travailler le cerveau mais aussi l oeil et l oreille ","B2"
"1283","1283","en brisant le fatum des itinéraires sociaux en augmentant le temps de la formation en accroissant l autonomie des individus les sociétés modernes ont inventé la jeunesse et celle ci ne cesse de s allonger jusqu à 25 ans et au delà ","B2"
"1284","1284","je ne me couche pas trop tard vers minuit","A1"
"1285","1285"," nous allons essayer à nouveau ndlr d entrer en contact avec lui  mais les chances de rétablir la liaison sont très très faibles  a déclaré à l afp stephan ulamec responsable de l atterrisseur depuis l agence spatiale européenne esa à darmstadt allemagne ","B2"
"1286","1286","ajoutons pour parfaire ce tableau que ces seniors ont reçu de la science la perspective d un quart de siècle de longévité supplémentaire traversé en relative bonne santé ","B2"
"1287","1287","une fois ces déclencheurs identifiés il faut alors élaborer des stratégies pour les éviter ou y faire face ","C2"
"1288","1288","elles se réveillèrent très tôt hier matin afin de se rendre au tribunal pour plaider la cause de leurs maris injustement accusés d escroquerie ","C1"
"1289","1289","après la transfusion le sang provenant d un don de sang complet ou d un don par aphérèse est congelé à une température de moins 30 degrés celsius et est mis en quarantaine ","C2"
"1290","1290","or peut on se contenter de cette expérience immédiate ou pour reprendre la formulation de bergson de cette donnée immédiate de la conscience ","C2"
"1291","1291","la compagnie qui le gère est à majorité anglaise ","B1"
"1292","1292","je profite aussi du petit déjeuner pour lire les infos en ligne","A1"
"1293","1293","toutefois ce système répond à des critères précis et exigeants difficilement compatibles avec le développement à grande échelle auquel il est appelé ","C1"
"1294","1294","oui la raison a pu s accommoder de la théologie païenne ","C1"
"1295","1295","confronté avec rien de pire qu un général en cuir crissant et ces mouvements légèrement percutants qui sont communs aux personnages militaires lesquels semblent aspirer l air au dedans sentent la poudre à canon et la chair de cheval et bien que léthargiques ont l air prêts à participer à une guerre encore indéterminée type d hommes pour lequel hedwige s était senti beaucoup d inclination  guido avait été secoué d un tremblement invisible ","C2"
"1296","1296","cette action avait pour objectif dès l origine d aider les professeurs à enseigner la science et la technologie en mettant en oeuvre une pédagogie privilégiant l expérimentation la discussion une pratique active et collective ","C2"
"1297","1297","elle portait une robe marron foncé qui moulait sa taille ses hanches sa gorge ses bras d une façon provocante et coquette  et duroy éprouvait un étonnement confus presque une gêne dont il ne saisissait pas bien la cause du désaccord de cette élégance soignée et raffinée avec l insouci visible pour le logis qu elle habitait ","C2"
"1298","1298","les papy boomers sont individualistes ce sont d ailleurs eux qui ont mis en vogue le concept ","B2"
"1299","1299","une politique de sécurité est un outil de gouvernance qui permet de traiter la sécurité comme un processus de gestion continu en fonction d objectifs stratégiques clairement définis ","C1"
"1300","1300","tout le monde n a pas l argent pour se payer une machine à laver ","B1"
"1301","1301","lettres de motivation d amour ou de rupture relecture de mémoires d étudiant textes d hommage à lire et à distribuer pendant des obsèques situations administratives à démêler avec la banque les impôts ou la copropriété l écrivain public doit pouvoir répondre à toutes les demandes ","C1"
"1302","1302","et donc je te remercie pour tout ton boulot ","A2"
"1303","1303","elle se rendit compte qu elle travaillait dans la pénombre et alluma la lampe posée sur le bureau ","B2"
"1304","1304","au premier étage il y a trois chambres","B1"
"1305","1305","paul a le numéro de téléphone de marie ","A1"
"1306","1306","ils font à manger et ils nettoient toujours la cuisine juste après ","A2"
"1307","1307","elles font des cracracracracraaa  et moi j en fais autant  on s amuse ","A2"
"1308","1308","en 2001 rosalie a expliqué à l onu auprès du groupe de travail sur les peuples autochtones en quoi la survie des bisons sauvages est essentielle et symbolique pour les indiens des plaines ","C1"
"1309","1309","si t as trouvé le vidéo le fun pense à aimer notre chaine youtube et notre page facebook","C1"
"1310","1310","par crainte des représailles les contestataires ont été moins nombreux mardi dans les rues ","B2"
"1311","1311","ce récit fascine toujours notre science fiction blade runner de ridley scott 1982 ou her de spike jonze 2013 en témoignent ","B2"
"1312","1312","mon énergie mon temps mon argent ","A2"
"1313","1313","qu est ce que tu penses de cette peinture ","A1"
"1314","1314","en france c est l enseignement catholique qui le premier a osé briser le tabou en rediscutant des vices et vertus de la mixité depuis ses assises de décembre 2000 ","C1"
"1315","1315","si nous sommes bloqués dans l ascenseur qui s est arrêté brusquement nous appellerons du secours dès que la communication sera établie ","B2"
"1316","1316","il vient de la racine slave robota qui signifie travail de force ","C2"
"1317","1317","il a donc rejeté tout changement de mode de scrutin qui introduirait des mécanismes partisans et abstraits dans ces collectivités où l appartenance politique des élus est fort peu prise en compte ","C1"
"1318","1318","mais les chocs pétroliers plongent la france dans la crise","C1"
"1319","1319","ce texte invite les états à prendre toutes les mesures possibles dans la pratique pour veiller à ce que les membres de leurs forces armées qui n ont pas atteint l âge de 18 ans ne participent pas directement aux hostilités art ","B1"
"1320","1320","vous êtes biologiste militante passionnée de cette pédagogie vous allez nous expliquer pourquoi le sujet vous passionne ","C1"
"1321","1321","souvent elle était rêveuse et taciturne  quelquefois elle parlait avec impétuosité ","C2"
"1322","1322","la dame ne vient pas ","A1"
"1323","1323","après cette crise qui se renouvelle toutes les nuits je dors enfin avec calme jusqu à l aurore","B2"
"1324","1324","elle raconte leur quotidien à travers les enfants qu elle a aussi aidés à faire leurs devoirs","A2"
"1325","1325","on peut voir aussi le fleuve qui traverse la capitale","B1"
"1326","1326","bruno bonnell le vieil adage on n arrête pas le progrès n a jamais été aussi vivace d autres pays s équipent en robotique pour atteindre des taux de productivité supérieurs aux nôtres ","C1"
"1327","1327","or la plupart du temps la jeunesse est heureuse ni aussi tragique ni aussi banale que ne le dessinent les clichés ","B2"
"1328","1328","de hauts sapins noirs interdisaient à la lumière du soleil de pénétrer dans le sous bois où serpentait un obscur sentier bordé de silhouettes menaçantes prêtes à nous bondir dessus ","C2"
"1329","1329","il s arrêta tristement à la porte d un cabaret ","B1"
"1330","1330","ouais ","A1"
"1331","1331","et des trous s enfoncèrent dans ces alluvions de l espace des trous infundibuliformes roux par lesquels filtra une lumière de lanterne sourde ","C2"
"1332","1332","le travail permet en effet à l homme de se libérer d aspects contraignant liés à l existence humaine","C2"
"1333","1333","je ne savais pas que bien plus tristement que les petits écarts de régime de son mari mon manque de volonté ma santé délicate l incertitude qu ils projetaient sur mon avenir préoccupaient ma grand mère au cours de ces déambulations incessantes de l après midi et du soir où on voyait passer et repasser obliquement levé vers le ciel son beau visage aux joues brunes et sillonnées devenues au retour de l âge presque mauves comme les labours à l automne barrées si elle sortait par une voilette à demi relevée et sur lesquelles amené là par le froid ou quelque triste pensée était toujours en train de sécher un pleur involontaire ","C2"
"1334","1334","les impôts sur l énergie comprennent essentiellement les impôts sur les carburants la taxe co2 sur les combustibles et le supplément sur les coûts de transport d électricité ","C1"
"1335","1335","j y suis allé hier en scooter ","A2"
"1336","1336","tu étais ma meilleure amie et tu avais toujours plein de bonnes idées pour s amuser","A2"
"1337","1337","oui comme entrée ","A1"
"1338","1338","il a demandé la raison de cette décision ","A2"
"1339","1339","s il fait beau l après midi vous pouvez aller au jardin du luxembourg ","A1"
"1340","1340","pourtant dans les années 1890 les garçons coiffeurs et les employés des grands magasins manifestent avec le soutien de la cgt pour obtenir une demi journée de repos hebdomadaire ","C2"
"1341","1341","de la même façon le gouvernement de la république du congo rdc s est engagé en mai 2002 à démobiliser des milliers d enfants servant dans son armée ","B1"
"1342","1342","personne n était intéressé par les discours du député","B1"
"1343","1343","enseigner à une enfant qu il peut réussir ","A2"
"1344","1344","vous ne passerez pas ","A2"
"1345","1345","il avait emprunté le couloir exigu qui menait aux dortoirs des filles ","C2"
"1346","1346","de quelles huées gouailleuses de quelles curiosités grossières n êut il pas été l objet et la victime ","B2"
"1347","1347","cette période marque l arrivée de noël et des fêtes de fin d année ","A1"
"1348","1348","bien sûr que tu vas y aller ","A1"
"1349","1349","il a trouvé un copain ","A1"
"1350","1350","en france le début des vacances est souligné par les soldes d été","B1"
"1351","1351","elle se retrouvait dans les lectures de sa jeunesse en plein walter scott ","C1"
"1352","1352","dans cette lettre au père noël ils listent méticuleusement tous les cadeaux qu ils souhaiteraient avoir au pied du sapin","B2"
"1353","1353","il avait naturellement conçu le désir de répéter ces prouesses et dès qu il eut seize ans il commença de s exercer ","B2"
"1354","1354","la deuxième jambe de notre projet axé sur le protéger  est mise en place depuis 2017 notamment avec nos mesures en matière d éducation comme le dédoublement des classes ","C1"
"1355","1355","j étais trop épuisé il m était impossible de continuer ","B1"
"1356","1356","il eut une consolation ","C1"
"1357","1357","dans cette zone les densités annuelles de campagnol terrestre connues à l échelle des communes ont été attribuées aux taches de prairie en utilisant une pondération par les surfaces relatives pour les taches chevauchant plusieurs municipalités  au terme de cette opération chaque tache de prairie a été caractérisée par une densité annuelle de campagnol terrestre ","C1"
"1358","1358","si les enfants écrivent une lettre au père noël est ce qu il répondra ","B1"
"1359","1359","ii y avait lu que j étais un honnête homme un travailleur régulier infatigable fidèle à la maison qui l employait aimé de tous et compatissant aux misères d autrui ","C2"
"1360","1360","après son enfance à vinci léonard est élève auprès du célèbre peintre et sculpteur florentin andrea del verrocchio ","B2"
"1361","1361","j ai été me plaindre à la mairie mais ça n a servi à rien ","B1"
"1362","1362","la didascalie offre un éclairage totalement nouveau de l oeuvre ","C2"
"1363","1363","peut on évoquer des sujets sérieux avec un accent du sud de la france ","B1"
"1364","1364","je voudrais la clé s il vous plaît ","A1"
"1365","1365","lucie entama d un air brave sa cavatine en sol majeur elle se plaignait d amour elle demandait des ailes ","C2"
"1366","1366","la science en fait partie ","B1"
"1367","1367","affirmant cela j entends déjà les ayatollahs du coq au vin les sermonneurs de la sauce béarnaise les adeptes de la sole meunière se dresser tel un seul homme brandissant leur gault et millau et leur michelin ","C1"
"1368","1368","tu peux assister à des cours de danse de hockey et de gym ","A1"
"1369","1369","il faut inciter la population à refuser les pailles en plastique ","B2"
"1370","1370","qu est ce qu ils font ","A1"
"1371","1371","si vous me dites où vous avez passé l hiver je vous donnerai une grande somme d argent ","A2"
"1372","1372","un automobiliste a été arrêté pour avoir brûlé un feu rouge ","B1"
"1373","1373","quel type de logement cherchez vous un appartement une maison ","B1"
"1374","1374","l épidémie de coronavirus nous contraint à éprouver l incertain de nos existences comme une dégradation provisoire ","C2"
"1375","1375","vous pleuriez beaucoup pourquoi ","A2"
"1376","1376","je te conseille vraiment la brasserie du métro qui est mon restaurant préféré tu ne le regretteras pas si tu y vas","B1"
"1377","1377","la dame du premier étage sans doute la même qui m a parlé au téléphone me dit que monsieur lindon m attend dans son bureau ","B1"
"1378","1378","en quittant chaque e tape mes enfants dessinaient le lieu ou une personne qu ils y avaient rencontre e","C2"
"1379","1379","il sut comment poursuivre dans les prés les poulains à demi sauvages comment les approcher en secret les surprendre d un saut et les maintenir par force les par la fatigue ","B2"
