"","id","sentence","difficulty"
"2349","2349","comme avec les sorcières sont nrv ecole des loisirs  qui n ont pas pris une ride depuis 1988 et où articles adverbes et pronoms entrent dans une danse endiablée ou encore avec lfhe la sorcière ecole des loisirs  où cette fois ce sont les adjectifs qui sont prestidigitisés","C2"
"2350","2350","il vient de demander la main de bella et l avenir semble briller mais quand l artiste donne le dernier coup de pinceau à sa toile les nazis ont déjà commencé à expulser les juifs contraints de quitter leurs maisons emportant ce qu ils peuvent ","B2"
"2351","2351","je réponds toujours que ça n a pas été difficile physiquement mais que j ai dû travailler sur l image que donnait ce comique ","B1"
"2352","2352","vous êtes embarrassée presque offensée de mon trouble ","C2"
"2353","2353","il a déjà inventé une machine à enlever la peau des bananes ","A2"
"2354","2354","oh ça fait du bien de changer d air quelques jours ","B1"
"2355","2355","après le cours vous boirez un verre en notre compagnie vous rirez aux éclats et aurez du bon temps avec vos amis ","B1"
"2356","2356","j aurais voulu pouvoir quitter le bureau à 13h ","B2"
"2357","2357","je mange de l herbe","A1"
"2358","2358","il faut du temps et du courage pour soigner toute cette ménagerie en plus des animaux il faut aussi s occuper du potager de mon papy","A2"
"2359","2359","nous devons apprendre une multitude de langages  scientifiques tels le numérique les langues étrangères les langages des sons et des images le langage du corps ","B2"
"2360","2360","c est la comme moration c est a dire la fe te anniversaire de la fin de la seconde guerre mondiale","B1"
"2361","2361","des variations significatives de cet indice sur une période inférieure à plusieurs décennies sont peu probables en l absence de réformes territoriales conséquentes ce qui a été rarement le cas en suisse après 2000 en comparaison internationale ","C2"
"2362","2362","statistiquement le risque de transmission de maladies infectieuses est nettement plus élevé dans certaines situations ","C1"
"2363","2363","j ai passé une très bonne journée de vacances ","A1"
"2364","2364","quelle est ta chanson préférée dans le spectacle ","A1"
"2365","2365","si on cherche des côtés positifs à cette bluette quelques répliques sont bien senties et des scènes comiques réussies notamment quand il est question des subtilités de notre langue et des faux amis ces mots qui se ressemblent entre anglais et français avec des significations différentes ","B2"
"2366","2366","la traçabilité permet de reconstituer une séquence d événements à partir des données numériques laissées dans les systèmes lors de leurs réalisations ","C1"
"2367","2367","anna s amusait avec son frère quand il s est cassé le bras gauche ","A2"
"2368","2368","oui je parle un peu ","A1"
"2369","2369","il y a deux possibilités  soit son accent lui permettra d être connu et ce sera très bien ","A2"
"2370","2370","après 13 ans aussi pour des raisons sociales l enfant commence à éprouver des contraintes caractérielles des réticences dues à la volonté de défendre son image à la peur du ridicule toutes choses qui sont des attitudes d adulte","C2"
"2371","2371","grande amoureuse des couleurs et de la cuisine italienne irène jacob a trouvé dans la culture slave la force de l expression des sentiments jusqu au tragique ","C1"
"2372","2372","je fais du sport tous les jours ","A2"
"2373","2373","non c est en fonction de la facilité de la chanson ","A2"
"2374","2374","la chine et l inde connaissent depuis dix ans une augmentation du taux de surpoids de 5  ","C1"
"2375","2375","bonjour ça va ","A1"
"2376","2376","donne moi de tes nouvelles plus souvent ","B1"
"2377","2377","oui des feux de forêt qui frappent le sud est du pays depuis le mois de septembre et qui ont fait une 24e victime ce week end","B1"
"2378","2378","mets ça sur ton pied ça va soulager la douleur ","A2"
"2379","2379","voie 3 le tgv à destination de marseille saint charles va partir","B2"
"2380","2380","la tour eiffel est le symbole de la ville de paris","B1"
"2381","2381","avec l argent notre professeur va acheter de la peinture et des crayons pour le cours de dessin ","A2"
"2382","2382","mais poursuit bacon la science se doit de surmonter ces craintes et ces scrupules elle doit triompher du sentiment d impuissance qui la paralyse ","C2"
"2383","2383","quel est votre avis ","A2"
"2384","2384","ils s étaient imaginé pouvoir surmonter le deuil en se lançant dans les travaux de rénovation ","B2"
"2385","2385","la comtesse se mit à revoir avec fabrice tous ces lieux enchanteurs voisins de grianta et si célébrés par les voyageurs  la villa melzi de l autre côté du lac vis à vis le château et qui lui sert de point de vue  au dessus le bois sacré des sfondrata et le hardi promontoire qui sépare les deux branches du lac celle de côme si voluptueuse et celle qui court vers lecco pleine de sévérité  aspects sublimes et gracieux que le site le plus renommé du monde la baie de naples égale mais ne surpasse point ","C1"
"2386","2386","ici dans le palais l air était lourd et étouffant mais dans la forêt le vent soufflait librement et le soleil de ses caressants doigts d or écartait les feuilles frémissantes ","C1"
"2387","2387","dès qu elle fut entrée elle fut dérangée par la cigarette ","C2"
"2388","2388","par ailleurs les conséquences structurelles d une telle reconnaissance pour une organisation ne sont pas négligeables","C2"
"2389","2389","cela étant bien compris je crois qu on se tiendra en repos  comme pascal edgar morin cherche à désarçonner le rationaliste qui au plein de la crise actuelle de notre rapport à la nature ne doute ni de ses démarches ni de sa volonté d imposer son ordre ","C2"
"2390","2390","en haut des tours il n est pas conseillé de s attarder trop longtemps devant le panorama parisien","C2"
"2391","2391","la discipline est encore considérée comme réservée aux hommes ","B2"
"2392","2392","je propose que tout le monde apporte quelque chose à manger ","A1"
"2393","2393","vous deviez rendre des comptes à la justice pour vos crimes ","B1"
"2394","2394","mais pas de maison de poupées","A2"
"2395","2395","j ai peur du noir ","A1"
"2396","2396","nous nous assîmes sur un banc recouvert de verdure face aux cieux étincellant et nous vîmes l aurore s éveiller ","C2"
"2397","2397","après ça nous étions un peu fatigués","A2"
"2398","2398","il s établit donc dans le petit public qui m environnait une inquiétude vague sur mon caractère ","C2"
"2399","2399"," le démon partit bien vite et il se précipita dans le trou où hélas il retrouva la méchante femme ","B1"
"2400","2400","pourtant les conséquences de la mise en place de telles pratiques de gestion permettent de s interroger sur les raisons véritables qui poussent une entreprise à évaluer ses connaissances","C2"
"2401","2401","ainsi l abbé blanès n avait pas communiqué sa science assez difficile à fabrice  mais à son insu il lui avait inoculé une confiance illimitée dans les signes qui peuvent prédire l avenir ","C1"
"2402","2402","la 9e conférence des nations unies sur le climat s est achevée hier dans une ambiance mi figue mi raisin ","C1"
"2403","2403","ok alors on se tient au courant pour samedi prochain ","A2"
"2404","2404","le falcon 1 est un lanceur théoriquement réutilisable qui peut placer selon son constructeur 670 kg en orbite basse ","C1"
"2405","2405","le gâteau est dans le frigo ","A2"
"2406","2406","née de la contraction anglaise de no mobile phobia  la nomophobie est en simplifiant une crainte obsédante et continuelle de ne pas avoir son smartphone en état de marche avec soi ","B2"
"2407","2407","des grosses parts pour les guerriers et pour zahor des petites parts pour les femmes et les enfants et enfin les os pour les chiens ","A2"
"2408","2408","le chien de ma voisine fais beaucoup de bruit ","A1"
"2409","2409","la réussite professionnelle fait oublier l âge l échec le rappelle reconnaît il ","C1"
"2410","2410","des délires il en a l artiste qui débarque d evry en île de france avec un baccalauréat littéraire en poche","B1"
"2411","2411","actuellement les moyens alloués pour le suivi des populations sont en diminution et l observation systématique de toutes les communes ou de toutes les zones est remise en question  dans ce contexte il semble intéressant de procéder au suivi des populations à partir d un découpage spatial spécifiquement dédié plutôt que d utiliser le maillage communal comme grille d observation ","C1"
"2412","2412","je compte bien arriver dès huit heures ","B1"
"2413","2413","il est un autre horizon qu annoncent les biologistes  la sixième extinction des espèces qui n épargnera que les animaux d élevage propres à l exploitation directe ","C1"
"2414","2414","il est peu probable que tu doives souvent arroser les plantes ","B2"
"2415","2415","ce métier ne convient que pour un début de carrière dans la vente par exemple ","B1"
"2416","2416","ils chevauchent un coq à taille humaine ","B2"
"2417","2417","ils faisaient une grande fête à chaque année ","B1"
"2418","2418","je ne sais quel instinct m avertissait d ailleurs de me défier de ces axiomes généraux si exempts de toute restriction si purs de toute nuance ","C2"
"2419","2419","je t appelerais dès que je reçois les documents","B1"
"2420","2420","c est le plat pre fe re de manon","A2"
"2421","2421","elle donne sur le jardin vous y serez très bien ","A1"
"2422","2422","la montée des valeurs humanistes est une réalité qui se poursuit et s affirme ","B2"
"2423","2423","nous vous remercions de votre compréhension et nous vous souhaitons une excellente journée ","A2"
"2424","2424","elle se déroule dans de nombreux pays mais à des dates et avec des traditions différentes ","A2"
"2425","2425","je suis allé voir où elle habite sans rien dire à personne ","A2"
"2426","2426","finalement il est aussi question de scepticisme réalisation du stoïcisme et décriant l être autre comme subjectif et remettant donc en cause son aspect véridique et absolu","C2"
"2427","2427","pour moi c est pas du tout frustrant je suis très content de partir en france et ça faisait très longtemps que j avais envie de venir en bretagne donc pour moi c était une très bonne opportunité ","B1"
"2428","2428","je vais donner des numéros ","A1"
"2429","2429","le gouvernement veut lutter contre la fraude dans la rénovation énergétique notamment en renforçant les contrôles et en s attaquant aux démarchages téléphoniques abusifs ","C2"
"2430","2430","plus que faire une visite le promeneur remontera le temps et découvrira ainsi une partie de l histoire de la région ","B1"
"2431","2431","en travaillant je bois beaucoup de thé ","B1"
"2432","2432","philae qui s est posé à l ombre entre des rochers a d abord fonctionné avec une pile d une durée de vie de 60 heures ","B1"
"2433","2433","dans un premier temps les locuteurs subissent une très forte pression  politique sociale ou économique  pour parler la langue dominante ","C1"
"2434","2434","elle est chanteuse et elle est malienne ","A1"
"2435","2435","à cette époque les conventions d appellation modernes ne se sont pas encore développées en europe ","C1"
"2436","2436","rien d autre ","A1"
"2437","2437","c est chouette ","A1"
"2438","2438","il sortit vivement le téléphone et jeta un oeil sur l écran avant de répondre ","B2"
"2439","2439","la balle est partie ","A1"
"2440","2440","aujourd hui c est une tarte aux framboises avec de la confiture faite maison","A2"
"2441","2441","si l esprit consiste à se saisir dans sa propre opposition à soi nulle période n est mieux marquée par son avènement que celle du subjectivisme absolu ","C2"
"2442","2442","a quelle distance en milles la cabane se trouve t elle de la ville ","B1"
"2443","2443","quand il y a un grand soleil sur la carte il fera chaud sur la région","B1"
"2444","2444","et si nous allions au cinéma","B1"
"2445","2445","moi aussi je veux aller me promener ","A1"
"2446","2446","abandonnez sans état d âme le traditionnel cahier de vacances que les trois quarts des enfants ne terminent pas  la liste des produits alternatifs qui visent à faire aimer autant qu à faire réviser est longue ","C1"
"2447","2447","la forêt leur donnait du bois en abondance pour les foyers et les édifices  les bêtes sauvages qui s en échappaient venaient se faire prendre dans leurs pièges et les fournissaient de venaison ","B2"
"2448","2448","l écriture semble être devenue la reconversion professionnelle à la mode dans le milieu du grand banditisme ","B2"
"2449","2449","vous avez une voiture mais vous l utilisez peu ","A2"
"2450","2450","l effet autocuiseur si sept millions de citadins rêvent de refaire leur vie aux champs tous ne passent pourtant pas à l acte ","C1"
"2451","2451","il peut également rendre addict  le smartphone est aujourd hui omniprésent dans nos vies  58  des français déclarent avoir leur mobile 24h sur 24 h avec eux  41  le consultent même au milieu de la nuit et 7  vont jusqu à répondre à leurs messages dans leur lit ","B2"
"2452","2452","il est assez calme ","A1"
"2453","2453","j ai pris du poisson avec du riz et mon frère a choisi un simple steak frites","A2"
"2454","2454","et dans cette ville inerte cette foule criarde si étonnamment passée à côté de son cri comme cette ville à côté de son mouvement de son sens sans inquiétude à côté de son vrai cri le seul qu on eût voulu l entendre crier parce qu on le sent sien lui seul  parce qu on le sent habiter en elle dans quelque refuge profond d ombre et d orgueil dans cette ville inerte cette foule à côté de son cri de faim de misère de révolte de haine cette foule si étrangement bavarde et muette ","C2"
"2455","2455","nous sommes normalement à un moment de l année où ce genre de phénomènes est en train de diminuer","A2"
"2456","2456","j ai hâte ","A1"
"2457","2457","il agite son petit nez rose quand il me voit ma grand mère fait des gâteaux tous les jours","A2"
"2458","2458","un néant à l égard de l infini un tout à l égard du néant un milieu entre rien et tout infiniment éloigné de comprendre les extrêmes  notre pascal est celui de l homme situé entre deux infinis mélange de folie et de sagesse ","C2"
"2459","2459","dans ma famille on adore goûter les spécialités locales alors on a tout essayé de la choucroute à la tarte flambée en passant par les kouglofs","B1"
"2460","2460","je suis nouveau ici ","A1"
"2461","2461","oui je me doute ","A1"
"2462","2462","florian kirchner chargé du programme espèces de l ong rappelle les nombreux enjeux et défis qui attendent notre pays mais aussi le monde en matière de conservation et de protection faunistique et floristique ","C1"
"2463","2463","en allemagne par exemple on n a pas cours l après midi tandis que nous restons au collège jusqu à 17 heures ","B1"
"2464","2464","comment vas tu ","A1"
"2465","2465","des enfants en choeur  des petits pois avec de la salade ","A2"
"2466","2466","non dit l un de ces messieurs nous vous demandons si vous n aimez pas tendrement le roi des bulgares ","B1"
"2467","2467","le régiment était composé de deux mille hommes  cela lui composa quatre mille coups de baguette qui depuis la nuque du cou jusqu au cul lui découvrirent les muscles et les nerfs ","B2"
"2468","2468","si les centaines de millions d affamés de la planète sont inacceptables la situation alimentaire internationale donne pourtant selon les spécialistes  des signes lents mais tangibles d amélioration ","C1"
"2469","2469","il était juste un peu curieux ","A2"
"2470","2470","ma chère sonia je suis bien arrivée à londres pour ma dernière année d études de marketing à l université ","B1"
"2471","2471","plusieurs pays ont commencé à appliquer les principes d une gestion intelligente d une ressource longtemps considérée comme inépuisable ","B2"
"2472","2472","il faudra bien que quelqu un aide le petit à le faire ","A2"
"2473","2473","le chaufffeur de bus est en retard ","A1"
"2474","2474","je ne vois aucune contradiction entre la promotion des langues régionales et la défense du français","C2"
"2475","2475","le poids croissant du japon l émergence des nouveaux pays industrialisés npi et surtout la montée en puissance spectaculaire de la chine rappellent des réalités beaucoup plus anciennes qu une hiérarchie économique entre les occidentaux et le reste du monde ","C2"
"2476","2476","il ne dit jamais rien qui puisse nous affecter outre mesure dans nos estimes de soi ","C1"
"2477","2477","il arrive bientôt ","A1"
"2478","2478","en effet me me si vous ne souhaitez pas acheter quelque chose il est toujours inte ressant de passer du temps dans les centres commerciaux","B1"
"2479","2479","du haut de la tour eiffel on peut voir les principaux monuments de paris","B1"
"2480","2480","c est en italie que les deux mots sont le plus souvent associés ","A2"
"2481","2481","quand le g20 du 15 avril décide le moratoire c est la première fois que la chine acceptait dans un cadre multilatéral de participer à un moratoire ","B2"
"2482","2482","les yeux de fabrice se mouillèrent il répandit des larmes en embrassant la comtesse mais sa résolution de partir ne fut pas un instant ébranlée ","C1"
"2483","2483","le menu est imaginé chaque jour en fonction de ce que les chefs trouvent au marché de lyon ","B1"
"2484","2484","nous nous interrogeons sur le soutien moral et financier des pouvoirs publics à une campagne de sensibilisation dont le message  achetez du café qui vous permette de dormir tranquille  encart publicitaire de la marque max havelaar france suinte la vieille culture coloniale qui marque encore aujourd hui nos imaginaires collectifs et notre rapport au monde le rôle de l état est il de financer des opérations de communication éthique d enseignes multinationales ","C1"
"2485","2485","ce sont elles qui les comptent et les mettent dans notre panier ","A2"
"2486","2486","les joueurs se furent rapidement ressaisis après la tentative désastreuse pour égaliser le score avant la mi temps ","C1"
"2487","2487","tu n oubliais pas  tu nettoyais la demeure de fond en combles ","B1"
"2488","2488","homme de réseaux le vagabond n a pas coupé les liens avec le pays qu il maintient grâce au solide maillage des postes européennes ","C2"
"2489","2489","revue une fois elle sera cette fois plus facilement accessible ","C1"
"2490","2490","selon les calculs du cnes la batterie de philae devait être totalement déchargée vers 02h00 gmt 03h00 locales ","B2"
"2491","2491","mais quand d un passé ancien rien ne subsiste aprés la mort des êtres après la destruction des choses seules plus frèles mais plus vivaces plus immatérielles plus persistantes plus fidèles l odeur et la saveur restent encore longtemps comme des âmes à se rappeler à attendre à espérer sur la ruine de tout le reste à porter sans fléchir sur leur gouttelette presque impalpable l édifice immense du souvenir ","C2"
"2492","2492","vous voyez le rôle de l école a changé ","A2"
"2493","2493","l année dernière je suis allé au bord de la loire pour les vacances ","A2"
"2494","2494","elle est grande ","A1"
"2495","2495","il y en a qui disent que c est trop mais pas moi ","B1"
"2496","2496","les sénateurs élus au scrutin majoritaire dont le siège devient vacant pour cause de décès d acceptation des fonctions de membre du conseil constitutionnel ou de défenseur des droits ou de prolongation au delà du délai de six mois d une mission temporaire confiée par le gouvernement sont remplacés par les personnes élues en même temps qu eux à cet effet ","C2"
"2497","2497","la naissance des etats nations dont l unité territoriale était étroitement liée à leur homogénéité linguistique a également joué un rôle décisif dans la consolidation des langues adoptées comme nationales et la marginalisation des autres ","C1"
"2498","2498","d après marx les hommes qui font du travail une contrainte sont ceux qui produisent les objets du désir des hommes","C2"
"2499","2499","je sais qu elle est souvent seule à la maison et que le soir il rentre très tard ","A2"
"2500","2500","c est pratique je veux dire le moment de convalescence vous portez un masque donc de toute façon en règle générale ça ne se voit pas","B1"
"2501","2501","le réalisateur m a expliqué qu il avait longtemps cherché l acteur idéal ","B1"
"2502","2502","car sans incertitude nous serions cantonnés à une vie morne dont la fresque ne serait teinte que de dégradés de gris en absence complète de couleurs","C2"
"2503","2503","en 2003 les français ont ainsi flambé 30 milliards d euros pour le plus grand profit de l industrie du secteur et de l état croupier qui prélève sa dîme ","C2"
"2504","2504","inversement les régions tempérées lointaines n intéressent que médiocrement les colonisateurs jusqu à l explosion démographique du vieux continent au xixe siècle moment où les pays neufs deviennent des polongements européens ","C2"
"2505","2505","ces enfants s étaient procuré quelques petites clefs et quand la nuit était bien noire ils essayaient d ouvrir les cadenas de ces chaînes qui attachent les bateaux à quelque grosse pierre ou à quelque arbre voisin du rivage ","C1"
"2506","2506","nous continuons de parler anglais à la maison car mes parents ne veulent pas que je perde ma langue natale","A2"
"2507","2507","des paysans et des seigneurs le plaid sur l épaule chantaient tous ensemble une chanson de chasse  puis il survint un capitaine qui invoquait l ange du mal en levant au ciel ses deux bras  un autre parut  ils s en allèrent et les chasseurs reprirent ","C2"
"2508","2508","l ensemble comporte également un nombre de pièces réduit ","C1"
"2509","2509","c est aussi un test pour les couples nouvellement formés ou qui n avaient jamais expérimenté la vie à deux ","B1"
"2510","2510","je lui ai demandé ce que nous devions faire ","A2"
"2511","2511","nous allons au restaurant ","A1"
"2512","2512","si vous ne mangez que des légumes ce restaurant n est pas pour vous ","B1"
"2513","2513","vous êtes française ","A1"
"2514","2514","il se vit pénétrant jusqu au coeur de la grande forêt et découvrant une femme qui dormait parmi les branches couchée sur un lit de mousse ","B2"
"2515","2515","j ai commencé ma journée en jouant du piano ","A2"
"2516","2516","si vous voulez venir avec moi je vous montrerai votre table ","A2"
"2517","2517","il existe des outils pour le repérer précisent les promoteurs de la méthode ","B2"
"2518","2518","le centre anatole france est situé dans le centre ville à quelques pas de la mairie ","B1"
"2519","2519","il est intéressant de noter que jusqu en 1995 le festival de deauville n était pas compétitif","A2"
"2520","2520","je réunis tous ceux qui j aime bien pour fêter l arrivée de l été ","A1"
"2521","2521","l hôtel avait une belle piscine dont je n ai pas eu le temps de profiter ","B1"
"2522","2522","une personne désappointée est une personne qui n a pas obtenu ce qu elle attendait ce qu elle espérait ","A2"
"2523","2523","certains juchés sur le toit ou l aile refusaient de descendre ","C1"
"2524","2524","mais cette année nous ne savons pas si nous pourrons y aller ","B1"
"2525","2525","le verbe d adnane était entièrement vacciné contre les mots omniprésents de la langue de bois de l époque comme s il avait des oreilles passoires filtrant les mots des médias et des haut parleurs plantés sur chaque quartier ","C2"
"2526","2526","il porte aussi des lunettes rouges","A1"
"2527","2527","ça me fait plaisir de manger de bonnes choses ","A2"
"2528","2528","chaque hiver constitue une nouvelle menace ","B2"
"2529","2529","il est agréable de se promener pour observer les papillons les abeilles et écouter le chant des oiseaux ","A1"
"2530","2530","un souffle de vent les dispersait la pierre s était de nouveau assombrie mais comme apprivoisés ils revenaient  elle recommençait imperceptiblement à blanchir et par un de ces crescendos continus comme ceux qui en musique à la fin d une ouverture mènent une seule note jusqu au fortissimo suprême en la faisant passer rapidement par tous les degrés intermédiaires je la voyais atteindre à cet or inaltérable et fixe des beaux jours sur lequel l ombre découpée de l appui ouvragé de la balustrade se détachait en noir comme une végétation capricieuse avec une ténuité dans la délinéation des moindres détails qui semblait trahir une conscience appliquée une satisfaction d artiste et avec un tel relief un tel velours dans le repos de ses masses sombres et heureuses qu en vérité ces reflets larges et feuillus qui reposaient sur ce lac de soleil semblaient savoir qu ils étaient des gages de calme et de bonheur ","C2"
"2531","2531","des réseaux nationaux puis internationaux se sont créés pour fournir des informations à leurs membres préparer des campagnes de sensibilisation voire faire du lobbying ","C1"
"2532","2532","on eût dit qu en faisant remarquer leurs ridicules je trahissais une confidence qu ils m avaient faite  on eût dit qu en se montrant à mes yeux tels qu ils étaient ils avaient obtenu de ma part la promesse du silence  je n avais point la conscience d avoir accepté ce traité trop onéreux ","C2"
"2533","2533","vous ne risquerez pas de vous ennuyer dans un lieu aussi animé ","A2"
"2534","2534","nous avons l habitude d acheter quinze pommes ce sont elles qui les comptent et les mettent dans notre panier ","A2"
"2535","2535","les motocyclettes peuvent se classer en différents types chaque type ayant des caractéristiques différentes telles que la maniabilité le poids ou la position de pilotage ","C1"
