"","id","sentence","difficulty"
"3509","3509","ce sera inoubliable j en suis sûr ","A1"
"3510","3510","le chat a alors fait tomber la télécommande ","A1"
"3511","3511","s il vous plaît ","A1"
"3512","3512","il y a un quartier très agréable pour aller se balader","A1"
"3513","3513","ma soeur s appelle laura elle a treize ans ","A1"
"3514","3514","alors voici ta chambre ","A1"
"3515","3515","des start up développent des solutions sur le thème de la reconnaissance temps réel de formes dans une vidéo ","C1"
"3516","3516","le sans gêne la frime sont critiqués ","B2"
"3517","3517","l approche des transformations socio économiques est aussi perçue à travers l évolution des activités et les mutations des structures démographiques qui aboutissent a de nouveaux contrastes géographiques ","C2"
"3518","3518","sur la table il y a un chat noir un petit livre un vase une assiette et un sac","A1"
"3519","3519","nous buvons seulement de l eau","A1"
"3520","3520","il fumait un paquet de cigarettes par jour avant d arrêter ","A2"
"3521","3521","il est bizarre ce chien ","A1"
"3522","3522","nous bénéficions tous de la couverture de toutes sortes de bienfaisantes et ingénieuses assurances mais plus nous avançons plus le combat contre la précarité s impose à nouveau ","C2"
"3523","3523","c est aussi le moment idéal pour profiter de l eau et aller nager à la mer ou à la piscine ","A1"
"3524","3524","moi je veux aller au zoo et à l aquarium et manger des glaces ","A1"
"3525","3525","je travaille dans une compagnie d assistance médicale en tant que médecin consultant pour la partie asie pacifique ","B2"
"3526","3526","aujourd hui la méthode est bien rodée ","B1"
"3527","3527","il vint l embrasser avant de rejoindre la cuisine ","A2"
"3528","3528","salut moi c est laura ","A1"
"3529","3529","et c étaient de longues discussions des disputes interminables au milieu desquelles je me glissais avec inquiétude et plaisir ","B2"
"3530","3530","le mardi ressemble au lundi sauf qu il n y a pas d activité après l école david rentre chez lui pour faire ses devoirs et se reposer ","A2"
"3531","3531","j espère que tu passes de bonnes vacances à limoges ","A2"
"3532","3532","c est la question que se pose grégoire ","A2"
"3533","3533","trois français sur quatre sert favorables à ce que les pensions des fonctionnaires soient calculées sur les salaires des dix dernières années et non plus des six derniers mois comme aujourd hui contre 25 dans le privé","C2"
"3534","3534","ce constat s appuie d abord sur des observations sur des animaux dits axéniques  dont la flore intestinale est absente ce qui est le cas lorsque l animal naît par césarienne ","C2"
"3535","3535","j attends votre réponse à bientôt ","A1"
"3536","3536","mes parents disent que l île est très jolie  il y a de très belles plages on va pouvoir nager ","A2"
"3537","3537","si nous savions employer correctement votre langue maternelle nous trouverions du travail en un rien de temps ","B2"
"3538","3538","je travaille de 9 heures à 12 heures ","A1"
"3539","3539","vous procéderez au paiement sécurisé en ligne de l opération ","B2"
"3540","3540","ce peintre a été profondément choqué par la légèreté dans laquelle ce critique d art a parlé de son oeuvre ","B2"
"3541","3541","tu aimais te déguiser en princesse quand tu étais petite ","A2"
"3542","3542"," l écologie est une pensée complexe qui contextualise toujours et toujours saisit les interactions et les rétroactions ","C2"
"3543","3543","on en doute ","B1"
"3544","3544","est ce que pouvez faire un fichier pdf quand tu as fait une histoire comme ça ","B1"
"3545","3545","monsieur le baron était un des plus puissants seigneurs de la westphalie car son château avait une porte et des fenêtres ","B1"
"3546","3546","tu es un vrai chef cuisinier","A1"
"3547","3547","la réaction de floculation peut présenter diverses modalités dans le dosage de l antitoxine diphtérique ","C2"
"3548","3548","telle étourdie par la gaieté des fidèles ivre de camaraderie de médisance et d assentiment mme verdurin juchée sur son perchoir pareille à un oiseau dont on eût trempé le colifichet dans du vin chaud sanglotait d amabilité ","C2"
"3549","3549","ceci pourrait donner lieu à des jeux interactifs qui sont un excellent moyen de mémorisation ","C2"
"3550","3550","et cette joie ancienne m apportant la connaissance de ma présente misère une route bossuée qui pique une tête dans un creux où elle éparpille quelque cases  une route infatigable qui charge à fond de train un morne en haut duquel elle s enlise brutalement dans une mare de maisons pataudes une route follement montant témérairement descendante et la carcasse de bois comiquement juchée sur de minuscules pattes de ciment que j appelle notre maison  sa coiffure de tôle ondulant au soleil comme un peau qui sèche la salle à manger le plancher grossier où luisent de têtes de clous les solives de sapin et d ombre qui courent au plafond les chaises de paille fantomales la lumière grise de la lampe celle vernissée et rapide des cancrelats qui bourdonne à faire mal ","C2"
"3551","3551","elle ne travaille pas","A1"
"3552","3552","c était très intéressant","A2"
"3553","3553","ils s engouffraient dans les sentiers puis se ruaient sur les arbres et tiraient sur leurs branches ","B2"
"3554","3554","même si on adore un livre il faut je pense accepter que certains passages du livre soient coupés ou modifiés car le travail d écriture est complètement différent du travail d adaptation cinématographique ","B2"
"3555","3555","la société spacex conçoit construit et commercialise les lanceurs falcon 9 les moteurs merlin qui les propulsent ainsi que le vaisseau cargo dragon et sa version habitée le crew dragon ","C1"
"3556","3556","des parents qui n arrivent pas à exercer pleinement leur autorité ","B1"
"3557","3557","selon l auteur les tests actuels encouragent les élèves à développer une pensée personnelle ","B2"
"3558","3558","il en résulte alors des conséquences désastreuses pour certaines espèces  pour le cerf on parle d une malformation de la mâchoire d une masse corporelle limitée d organes sous dimensionnés et d une vie sexuée réduite ","C1"
"3559","3559","et il faut construire les marionnettes faire les costumes faire les décors faire la mise en scène faire les enregistrements ","A2"
"3560","3560","chez les gros utilisateurs cette communication comblerait un vide existentiel et contrecarrerait une vie sociale réelle insatisfaisante ","C2"
"3561","3561","parfois cette épreuve se passe mal entre autonomie et dépendance entre succès et échecs ","B2"
"3562","3562","en plus de son rôle si important pour la recherche en génétique et en biologie moléculaire de pourvoyeur de quantité illimitée d adn à partir d un infime échantillon la pcr s avérera un outil indispensable notamment au diagnostic de plusieurs maladies et à la génétique forensique ","C2"
"3563","3563","elle génère donc un espace où se manifestent des modes d expression très divers en fonction des projets de séances qui présentent plus ou moins d improvisation ou de mise en forme ainsi qu en fonction de la variabilité et de la composition des groupes ","C2"
"3564","3564","cependant dans certains cas les exploitants veulent rentabiliser leur concession au maximum et dans des délais beaucoup trop courts d un point de vue écologique ","B2"
"3565","3565","on mange à 20 heures ou plus tard","A1"
"3566","3566","laurine courait maintenant s abandonnait tout à fait au plaisir de ce jeu nouveau et la figure rose elle se précipitait d un grand élan d enfant ravie à chacune des fuites à chacune des ruses à chacune des feintes de son compagnon ","C2"
"3567","3567","catherine nave bekhti secrétaire générale du sgen cfdt  juge cette nouvelle interdiction inutile ","B2"
"3568","3568","eviter d importer de l inflation et surtout contrôler le niveau de change du franc suisse par rapport aux grandes devises internationales et notamment face à l euro et au dollar ","C1"
"3569","3569","quoique brève notre entrevue a été productive ","B2"
"3570","3570","il y a essentiellement trois grandes catégories ","B2"
"3571","3571","il a les yeux marron ","A1"
"3572","3572","je suis allé la voir dès que j ai appris qu elle avait des problèmes ","B1"
"3573","3573","le matin où à la suite d une orgie il se trouva décidément volé il acheta deux beaux chevaux prit pour domestique un ancien soldat palefrenier du maquignon et dans son mépris pour les jeunes parisiens beaux parleurs partit pour l armée ","C1"
"3574","3574","nous devons nous envisager autant comme citoyens du monde que comme héritiers d une vieille nation ","C2"
"3575","3575","elle a 21 ans","A1"
"3576","3576","de plus ce dernier doit apprendre à bien tenir son chien pour permettre à l animal de bien le conduire ","B1"
"3577","3577","conservation ou exploitation ","B2"
"3578","3578","en entendant la porte d entrée s ouvrir elle leva les yeux de l ordinateur et aperçut son mari ","B1"
"3579","3579","les industriels ont entrepris des recherches pour améliorer les procédés de fabrication les rendre moins énergivores et limiter les déchets à la source mais la question des matériaux déjà existants se pose aujourd hui bien que les besoins ne soient pas immédiats ","C2"
"3580","3580","je suis né à toronto ","A1"
"3581","3581","dans cette série tv connue pour inspirer les geeks de tout âge et toute nationalité  le holodeck est une espèce de salle de jeu capable de matérialiser n importe quel environnement apparemment sans nécessiter aucune interface particulière ","C1"
"3582","3582","j ai détesté la littérature à l école en plus de ça","A2"
"3583","3583","de plus certaines limitations sont également apparues en termes de puissance ou bien de permis de conduire ","B2"
"3584","3584","j habite à paris ","A1"
"3585","3585","je suis papa ","A1"
"3586","3586","le bulletin de notes du gouvernement a piètre allure ","B2"
"3587","3587","j aime beaucoup cette exposition ","A1"
"3588","3588","toutes ses velléités de dénigrement s évanouissaient sous la poésie du rôle qui l envahissait et entraînée vers l homme par l illusion du personnage elle tâcha de se figurer sa vie cette vie rétentissante extraordinaire splendide et qu elle aurait pu mener cependant si le hasard l avait voulu ","C2"
"3589","3589","gros bisous et merci beaucoup pour cette nouvelle histoire ","A2"
"3590","3590","suite à une série de retards cet employé a été mis à pied pour une durée indertéminée","C2"
"3591","3591","ils vont habiter tous les deux dans un joli appartement à paris ","A2"
"3592","3592","aussitôt que vous eûtes résolu ce problème vous partîtes ","C2"
"3593","3593","le public n a pas reconnu son talent ","A2"
"3594","3594","et la grande personne était bien contente de connaître un homme aussi raisonnable ","B1"
"3595","3595","mais il y a un problème ","A1"
"3596","3596"," malheureusement on voit souvent la capacité à parler anglais comme une force mais pas forcément d autres langues regrette madame ","B1"
"3597","3597","les linguistes estiment qu un idiome ne peut survivre qu à condition de compter au moins 100 000 locuteurs ","C1"
"3598","3598","les éternels affrontements entre ceux qui militent pour la protection inconditionnelle de sanctuaires naturels et ceux qui défendent les intérêts économiques des compagnies forestières semblent même passés de mode ","B2"
"3599","3599","occasionnellement kassák ment sur ses intentions sa profession ou sa confession  il se dit ainsi juif pour bénéficier d une caisse d entraide juive autre réseau élaboré à l échelle européenne et manque de se faire démasquer lorsqu il tient son livre de prières à l envers ou peine à retenir les quelques lignes de prière apprises phonétiquement ","C2"
"3600","3600","c est peut être une petite soeur un gentil chat comme moi ","A1"
"3601","3601","au delà de la pression réglementaire les entreprises qui s engagent dans le recyclage des déchets professionnels s inquiètent de la diminution des matières premières qui entrent dans la composition de ces appareils  des métaux rares du cuivre du fer ","B2"
"3602","3602","ils permirent ainsi pour le meilleur et pour le pire cette grande transformation qui multiplia les productions et autorisa l augmentation colossale de l espèce humaine ","C2"
"3603","3603","c est vraiment dommage que les gens ne fasse pas attention à ce qu ils consomment","B1"
"3604","3604","nous parlons français lorsque nous sommes dehors à l école ou au marché","A1"
"3605","3605","ils rentrèrent au pays après qu ils eurent vécu en europe","C2"
"3606","3606","ils n ont tout simplement aucune classe ","B1"
"3607","3607","c est à la fin du xixe siècle que les scientifiques commencent à s intéresser de manière raisonnée  aux capacités intellectuelles des hommes et des femmes ","B2"
"3608","3608","en me levant ce matin j avais très mal à la tête ","B1"
"3609","3609","j adore l odeur du napalm au petit matin ","B2"
"3610","3610","comme un rappel du massacre des quelque 60 millions de bisons orchestré à la fin du xixe siècle pour venir à bout des peauxrouges ","C1"
"3611","3611","ted ce sont des conférences au cours desquelles les intervenants doivent parler pendant 20 minutes sans notes ","B2"
"3612","3612","déplorant que le sénat ait préféré au contraire en rester aux dispositions initiales du projet de loi il a conclu en constatant qu il semblait dans ces conditions difficile de trouver une conciliation permettant d aboutir à un accord en commission mixte paritaire ","C2"
"3613","3613","à cette occasion les parents cachent des oeufs en chocolat dans la maison et le jardin et les enfants s amusent à les chercher ","A2"
"3614","3614","on a droit à tout sauf à la qualité ","B1"
"3615","3615","tout est prêt ","A1"
"3616","3616","ma contrainte avec lui eut une grande influence sur mon caractère ","B2"
"3617","3617","en allemagne l université de potsdam donne aux réfugiés qui ont été enseignants dans leur pays d origine la possibilité de devenir assistants puis professeurs dans les écoles allemandes qui manquent d enseignants ","B2"
"3618","3618","tout le chapelet de sociétés effectivement connectées dont l antiquité méditerranéenne puis l europe médiévale ne formaient que l extrémité occidentale ne peut plus apparaître uniquement comme un ensemble d anciennes civilisations plus ou moins rétives à la modernité objets de l orientalisme ","C2"
"3619","3619","c est dans cette voie  ouverte entre la timidité aristotélicienne et l audace insensée des alchimistes  qu allait passer toute la science de l avenir ","C2"
"3620","3620","malgré les progrès accomplis la situation alimentaire mondiale reste donc préoccupante surtout si on la met en relation avec les données démographiques ","C1"
"3621","3621","comme sa valise est trop petite il demande à hélène si elle veut toujours bien lui en prêter une  il peut venir la chercher chez elle puisqu ils n habitent pas loin l un de l autre ","A2"
"3622","3622","la vapeur se contournait en spirales autour des groupes de palmiers entre lesquels apparaissaient de pittoresques bungalows ","B2"
"3623","3623","le jardin est long et étroit il y a une balançoire au fond et un barbecue proche de la terrasse sur laquelle est posée un transat","B1"
"3624","3624","le bus est certes très pratique mais très dépendant de la qualité du trafic ","B2"
"3625","3625","notre charrette avait franchi le sommet d un autre monticule  en face de nous s étalait l immense étendue de la lande semée de rocs et de rochers ","C1"
"3626","3626","j ajoute que vous êtes aussi fondatrice d une association  inversons la classe ","C2"
"3627","3627","il faut bien faire attention à ses vêtements et à sa coiffure","A2"
"3628","3628","ne trouves tu pas que ces vieux murs noircis symboles maintenant et autrefois moyens du despotisme sont une véritable image du triste hiver ","C1"
"3629","3629","parallèlement à l urbanisation et à la déchristianisation de la société française le septième jour libéré de ces contraintes est entré dans l ère du temps libre ","C2"
"3630","3630","je suis vraiment content que tu aies pu venir ","A2"
"3631","3631","l ordre de grandeur pour le moment par exemple pour l afrique est environ 350 milliards d euros de dette à l égard de ses créanciers ","B2"
"3632","3632","il s est également arrêté dans une boulangerie où il a longuement hésité entre un pain au chocolat un croissant et une brioche aux pralines pâtisserie typiquement lyonnaise","B2"
"3633","3633","c est une excellente idée ","B1"
"3634","3634","ellénore gardait le silence ","B2"
"3635","3635","il interroge surtout la prétendue affinité élective de celle ci avec le seul monothéisme ","C1"
"3636","3636","je me suis creusé la tête sans relache durant des heures pour résoudre ce casse tête chinois ","C1"
"3637","3637","dans le désert tous les hommes n ont pas la peau noire ","B1"
"3638","3638","a cette occasion les enfants offrent des cadeaux à leur mère mais aussi de jolis oeillets ","B1"
"3639","3639","à partir de récits de vie elles dissèquent les motivations des candidats à la reconversion professionnelle ","C1"
"3640","3640","j ai mangé un hamburger et des frites ","A1"
"3641","3641","ce petit nombre est notamment dû à ses expérimentations constantes et parfois désastreuses de nouvelles techniques ","C1"
"3642","3642","j ai ensuite beaucoup pratiqué grâce à mon addiction à internet","C2"
"3643","3643","je passai quelques heures à ses pieds me proclamant le plus heureux des hommes lui prodiguant mille assurances de tendresse de dévouement et de respect éternel ","C2"
"3644","3644","il est alors témoin d un spectacle étonnant ","A2"
"3645","3645","les enfants grands sont maudits par les dieux c est le vieux zahor qui l a dit ","B1"
"3646","3646","est ce qu il y a des devoirs ","A1"
"3647","3647","qu est ce que vous faites le samedi et le dimanche ","A1"
"3648","3648","globalement presque une personne sur cinq 18 9  vit dans un ménage avec au moins un type d arriéré de paiement et 10 0 avec au moins deux types d arriérés de paiement le pourcentage de la population avec un ou deux types d arriérés de paiement dimunant avec l âge le niveau de formation et les revenus ","C1"
"3649","3649","ils avaient auparavant reçu une lettre d une veuve qui après avoir consacré sa vie à élever seule ses enfants ne recevait leurs visites qu en de très rares occasions ","B2"
"3650","3650","je fais mon lit tous les jours bien sûr et je fais souvent la vaisselle ","A2"
"3651","3651","il n y a presque pas de pollution","B1"
"3652","3652","s écriait elle en saisissant les mains de fabrice ","B2"
"3653","3653","serveur  une table pour quatre n est ce pas ","A2"
"3654","3654","pour éviter un oubli vous pouvez consulter le guide des formalités en ligne ","B2"
"3655","3655","un jour qu il était venu nous voir à paris après dîner en s excusant d être en habit françoise ayant après son départ dit tenir du cocher qu il avait dîné chez une princesse   oui chez une princesse du demi monde  avait répondu ma tante en haussant les épaules sans lever les yeux de sur son tricot avec une ironie sereine ","C2"
"3656","3656","s il fait beau l après midi vous pouvez aller au jardin du luxembourg et le soir vous pouvez faire un tour en bateau jusqu à la tour eiffel ","A1"
"3657","3657","elle a beaucoup de mal à avancer dans la neige ","A2"
"3658","3658","le récit s ordonne par l accumulation de saynètes procédé qui donne une tonalité picaresque au parcours mais qui participe aussi à ancrer les souvenirs d une mobilité dans des lieux ne seraient ils que de passage ","C2"
"3659","3659","au village il y a les pour et les contre ","B1"
"3660","3660","l employeur a en effet déjà obligation de prendre en charge la moitié de l abonnement aux transports en commun de ses salariés ","B2"
"3661","3661","elle a 84 ans et elle habite à antibes","A1"
"3662","3662","les femmes sont sous représentées dans le domaine des sciences ","B2"
"3663","3663","bonjour je vous appelle au sujet de mon imprimante photo ","A1"
"3664","3664"," à ses proches","A2"
"3665","3665","il ne change pas facilement d avis il est têtu ","B1"
"3666","3666","le rythme d extinction des langues a ainsi atteint des proportions sans précédent dans l histoire  10 par an à l échelle mondiale ","C1"
"3667","3667","plusieurs études ont démontré que l écobilan des modules photovoltaïques énergie grise émission du gaz à effet de serre  est relativement positif comparé à d autres filières de production d énergie ","C2"
"3668","3668","ce dépassement rétroactif de la renaissance européenne a pour conséquence l abandon du modèle évolutionniste linéaire tel que l europe des lumières puis le positivisme du xixe siècle l avaient formalisé ","C2"
"3669","3669","clara a bu de l eau son frère a bu un verre de vin","A1"
"3670","3670","il y a une ruée vers  devenons un peu plus indépendants moins dépendants des magasins de l importation des grandes surfaces  donc une espèce de retour au savoir faire artisan un peu de nos ancêtres de nos parents de nos grands parents ","B2"
"3671","3671","il s agit d un projet pour la paix de notre temps ","B1"
"3672","3672","tout comme les comportements des animaux sont déterminés par l instinct leur environnement ou des déterminations biologiques les actes et les pensées des hommes le sont eux mêmes par de multiples facteurs à la fois internes et externes dont on ignore le plus souvent l existence et la puissance  facteurs d origine physiologiques psychologiques sociales etc","C2"
"3673","3673","voilà le chemin à suivre finissons en avec ce décalage inacceptable entre la cuisine d en haut consommée par une minorité et la cuisine d en bas celle de la majorité silencieuse débordante et insipide ","C1"
"3674","3674","s ils vont au cinéma pour l avant première ils verront le dernier film de ce réalisateur de notoriété internationale ","B2"
"3675","3675","vous pouvez expliquer encore une fois s il vous plaît ","A1"
"3676","3676","il y a eu trois expéditions ","B1"
"3677","3677","les inuits attendent seulement d elle une déclaration politique ","C1"
"3678","3678"," on pensait autrefois que si les régimes alimentaires étaient suffisamment énergétiques les micronutriments suivraient  explique ainsi barbara burlingame fonctionnaire principale de la fao ","C1"
"3679","3679","considéré dès sa naissance comme un fils à part entière par son père il ne fut cependant jamais légitimé ","C2"
"3680","3680","nous sommes en 1915 à vitebsk la ville natale de marc chagall ","B2"
"3681","3681","un présage connu rapporte qu un milan venu du ciel aurait fait un vol stationnaire au dessus de son berceau la queue de l oiseau le touchant au visage ","C2"
"3682","3682","cet héritage s est d ailleurs vite révélé hétérogène  les pays pauvres d asie orientale les plus éloignés des anciennes métropoles  émergent à des degrés divers dans l économie mondiale dès les années 1970 1980 ","C2"
"3683","3683","trop se spécialiser dans un environnement qui change sans cesse c est comme rouler vite avec des oeillères ","C2"
"3684","3684","merci madame biologiste vous avez fondé le site l association inversons la classe ","C1"
"3685","3685","je crois qu en cinquante ans d amitié on ne s est pas disputées une fois on a eu des petits mots de temps en temps mais jamais on s est fait la tête jamais on n est restées sans se parler jamais jamais jamais ","A1"
"3686","3686","plusieurs milliers de classes ont participé à ce projet ","C2"
"3687","3687","bref première leçon le québécois n est pas un français déformé mais plutôt un français historique proche de celui qui était parlé en france avant le 17e siècle","C1"
"3688","3688","l extrémité supérieure de la corde est attachée à une planchette doublée de liège et une branche de coudrier très flexible fichée sur cette planchette soutient une petite sonnette qui tinte lorsque le poisson pris à la ligne donne des secousses à la corde ","C1"
"3689","3689","et c était pas forcément une image qui me plaisait comme j avais l occasion de pouvoir les changer j ai voulu le faire","B1"
"3690","3690","une semaine au calme ça procure un vrai plaisir ","B1"
"3691","3691","il faut aussi poser des questions sur le travail et les horaires de l entreprise","A2"
"3692","3692","je recherche une personne pour garder mes enfants de 1 et 7 ans ","A1"
"3693","3693","je vais prendre ma douche dans ma salle de bain ","A1"
"3694","3694","êtes vous prêts à découvrir cette histoire de noël ","A2"
"3695","3695","il passa contre nous ne s interrompit pas de parler à sa voisine et nous fit du coin de son oeil bleu un petit signe en quelque sorte intérieur aux paupières et qui n intéressant pas les muscles de son visage put passer parfaitement inaperçu de son interlocutrice  mais cherchant à compenser par l intensité du sentiment le champ un peu étroit où il en circonscrivait l expression dans ce coin d azur qui nous était affecté il fit pétiller tout l entrain de la bonne grâce qui dépassa l enjouement frisa la malice  il subtilisa les finesses de l amabilité jusqu aux clignements de la connivence aux demi mots aux sousentendus aux mystères de la complicité  et finalement exalta les assurances d amitié jusqu aux protestations de tendresse jusqu à la déclaration d amour illuminant alors pour nous seuls d une langueur secrète et invisible à la châtelaine une prunelle énamourée dans un visage de glace ","C2"
"3696","3696","il ne reste donc plus qu à attendre ","A2"
